{
  "format": "siok-retranslation-overlay",
  "formatVersion": 1,
  "scope": "aid",
  "assetKey": "AID_ID00023",
  "baseline": {
    "sha256": "e1c6145fba10c34b38548169bf7470b9684f7f5eba48c8b6bfe47254c004530b",
    "rowCount": 62937
  },
  "translationPolicy": {
    "method": "fresh-from-japanese",
    "existingTranslations": "reference-only"
  },
  "entries": [
    {
      "entryId": "AID_ID00023/Sheet1/000002",
      "sourceBindingSha256": "c0d515f76e4e82972d09e5eb560c88771d802ad6f4e6f28bda0d2c68482c94ea",
      "sourceTextSha256": "0a52c7253dd9d6ae62c816729dd95c24c35b0eee721da261475186a589c5f88f",
      "freshTranslation": "瑩㊦",
      "translationStatus": "draft",
      "translator": "Google Translate ja→ko (자동 초안)",
      "reviewer": "",
      "referenceConsulted": false,
      "notes": "일본어 원문 기준 자동 번역 초안; 기존 번역 미참조"
    },
    {
      "entryId": "AID_ID00023/Sheet1/000003",
      "sourceBindingSha256": "df34b10e47081545018a636c3825b3b69979f708336dc9b876550ccc4718584a",
      "sourceTextSha256": "840ff424f40b8ed215d6f44e416dea0977237025460c638e0ff219e6b6f2db06",
      "freshTranslation": "新多元世紀０００１年⑲４月４日㊦㊦㊦㊦㊦㊦㊦㊦㊦㊦㊦㊦㊦㊦㊦㊦㊦㊦㊦㊦㊦㊦㊦㊦㊦㊦㊦㊦㊦㊦㊦㊦㊦㊦㊦㊦㊦㊦㊦㊦㊦㊦㊦㊦㊦㊦㊦㊦㊦㊦㊦㊦",
      "translationStatus": "draft",
      "translator": "Google Translate ja→ko (자동 초안)",
      "reviewer": "",
      "referenceConsulted": false,
      "notes": "일본어 원문 기준 자동 번역 초안; 기존 번역 미참조"
    },
    {
      "entryId": "AID_ID00023/Sheet1/000004",
      "sourceBindingSha256": "65fb4640cad1d0ee335126f16d2d3187345c4eacf6ae9f85b97a7382b7996551",
      "sourceTextSha256": "b69482e23be20c25c64cdac366becc03e934d144ea47f5b6c9ff267b849f5e76",
      "freshTranslation": "신세시 공진동에 의한 혼란은 침착하고 있었지만,㊦㊦㊦㊦㊦㊦㊦㊦㊦㊦㊦㊦㊦㊦㊦㊦㊦㊦㊦㊦㊦㊦㊦㊦㊦㊦㊦㊦㊦㊦㊦㊦㊦㊦㊦㊦",
      "translationStatus": "draft",
      "translator": "Google Translate ja→ko (자동 초안); Codex 제어 토큰 단위 재번역",
      "reviewer": "",
      "referenceConsulted": false,
      "notes": "일본어 원문 기준 자동 번역 초안; 기존 번역 미참조; 제어 토큰 사이 일본어 조각을 분리해 원문 기준 재번역"
    },
    {
      "entryId": "AID_ID00023/Sheet1/000005",
      "sourceBindingSha256": "e5cab7b2e0a617b6cf6854d1456eaba2769898eac0dd065b09922507d5a74f66",
      "sourceTextSha256": "64ea346e1606bd9a52fdca9dc1f57201a13cb8640b94b6f735eb3d08d123628d",
      "freshTranslation": "한편 범죄의 건수는 증가하고 있었다.㊦㊦㊦㊦㊦㊦㊦㊦㊦㊦㊦㊦㊦㊦㊦㊦㊦㊦㊦㊦㊦㊦㊦㊦㊦㊦㊦㊦㊦㊦㊦㊦㊦㊦㊦㊦㊦㊦㊦㊦㊦㊦㊦㊦㊦㊦㊦㊦㊦㊦",
      "translationStatus": "draft",
      "translator": "Google Translate ja→ko (자동 초안); Codex 제어 토큰 단위 재번역",
      "reviewer": "",
      "referenceConsulted": false,
      "notes": "일본어 원문 기준 자동 번역 초안; 기존 번역 미참조; 제어 토큰 사이 일본어 조각을 분리해 원문 기준 재번역"
    },
    {
      "entryId": "AID_ID00023/Sheet1/000006",
      "sourceBindingSha256": "8a8f2dc3f8cd20d5cc51f3e72d71ddaced6d90e5d9aec3962e4eb85e06cbae8a",
      "sourceTextSha256": "547b1a840c2352775121af8e543785804a91a3ffb6ee880d1d9dbd84695aafd2",
      "freshTranslation": "그 중 불가해한 사건에 대해 ICPO는 위신을 내기㊦㊦㊦㊦㊦㊦㊦㊦㊦㊦㊦㊦㊦㊦㊦㊦㊦㊦㊦㊦㊦㊦㊦㊦㊦㊦㊦㊦㊦㊦㊦㊦",
      "translationStatus": "draft",
      "translator": "Google Translate ja→ko (자동 초안); Codex 제어 토큰 단위 재번역",
      "reviewer": "",
      "referenceConsulted": false,
      "notes": "일본어 원문 기준 자동 번역 초안; 기존 번역 미참조; 제어 토큰 사이 일본어 조각을 분리해 원문 기준 재번역"
    },
    {
      "entryId": "AID_ID00023/Sheet1/000007",
      "sourceBindingSha256": "d4ab80fe5fb2a54ca97d1a806701d54740275f2f9720882457d8b9dd9ed49cbe",
      "sourceTextSha256": "02716359a1b6a583af2b3c50c3568a2b6b5ac85ce5116fa1c98354b45e3f5d4c",
      "freshTranslation": "팔찌 수사관을 보내고 있었다…㊦㊦㊦㊦㊦㊦㊦㊦㊦㊦㊦㊦㊦㊦㊦㊦㊦㊦㊦㊦㊦㊦㊦㊦㊦㊦㊦㊦㊦㊦㊦㊦㊦㊦㊦㊦㊦㊦㊦㊦㊦㊦㊦㊦㊦㊦㊦㊦㊦㊦㊦㊦㊦㊦㊦㊦㊦㊦㊦㊦㊦㊦㊦㊦㊦㊦㊦㊦㊦㊦㊦㊦㊦㊦㊦㊦㊦㊦㊦㊦㊦㊦㊦㊦㊦㊦㊦㊦㊦㊦㊦㊦㊦㊦㊦㊦㊦㊦㊦㊦㊦㊦㊦㊦㊦㊦㊦㊦㊦㊦㊦㊦㊦㊦㊦㊦㊦㊦㊦㊦㊦㊦㊦㊦㊦㊦㊦㊦㊦㊦㊦㊦㊦㊦㊦㊦㊦㊦㊦㊦㊦㊦㊦㊦㊦㊦㊦㊦㊦㊦㊦㊦㊦㊦㊦㊦㊦㊦㊦㊦㊦㊦㊦㊦㊦㊦㊦㊦㊦㊦㊦㊦㊦㊦㊦㊦㊦㊦㊦㊦㊦㊦㊦㊦㊦㊦㊦㊦㊦㊦㊦㊦㊦㊦㊦㊦㊦㊦㊦㊦㊦㊦㊦㊦㊦㊦㊦㊦㊦㊦㊦㊦㊦㊦㊦㊦㊦㊦㊦㊦㊦㊦㊦㊦㊦㊦㊦㊦㊦㊦㊦㊦㊦㊦㊦㊦㊦㊦㊦㊦㊦㊦㊦㊦㊦㊦㊦㊦㊦㊦㊦㊦㊦㊦㊦㊦㊦㊦㊦㊦㊦㊦㊦㊦㊦㊦㊦㊦㊦㊦㊦㊦㊦㊦㊦㊦㊦㊦㊦㊦㊦㊦㊦㊦㊦㊦㊦㊦㊦㊦㊦㊦㊦㊦㊦㊦㊦㊦㊦㊦㊦㊦㊦㊦㊦㊦㊦㊦㊦㊦㊦㊦㊦㊦㊦㊦㊦㊦㊦㊦㊦㊦㊦㊦㊦㊦㊦㊦㊦㊦㊦㊦㊦㊦㊦㊦㊦㊦㊦㊦㊦㊦㊦㊦㊦㊦㊦㊦㊦㊦㊦㊦㊦㊦㊦㊦㊦㊦㊦㊦㊦㊦㊦㊦㊦㊦㊦㊦㊦㊦㊦㊦㊦㊦㊦㊦㊦㊦㊦㊦㊦㊦㊦㊦㊦㊦㊦㊦㊦㊦㊦㊦㊦㊦㊦㊦㊦㊦㊦㊦㊦㊦㊦㊦㊦㊦㊦㊦㊦㊦㊦㊦㊦㊦㊦㊦㊦㊦㊦㊦㊦㊦㊦㊦㊦㊦㊦㊦㊦㊦㊦㊦㊦㊦㊦㊦㊦㊦㊦㊦㊦㊦㊦㊦㊦㊦㊦㊦㊦㊦㊦㊦㊦㊦㊦㊦㊦㊦㊦㊦㊦㊦㊦㊦㊦㊦㊦㊦㊦㊦㊦㊦㊦㊦㊦㊦㊦㊦㊦㊦㊦㊦㊦㊦㊦㊦㊦㊦㊦㊦㊦㊦㊦㊦㊦㊦㊦㊦㊦㊦㊦㊦㊦㊦㊦㊦㊦㊦㊦㊦㊦㊦㊦㊦㊦㊦㊦㊦㊦㊦㊦㊦㊦㊦㊦㊦㊦㊦㊦㊦㊦㊦㊦㊦㊦㊦㊦㊦㊦㊦㊦㊦㊦㊦㊦㊦㊦㊦㊦㊦㊦㊦㊦㊦㊦㊦㊦㊦㊦㊦㊦㊦㊦㊦㊦㊦㊦㊦㊦㊦㊦㊦㊦㊦㊦㊦㊦㊦㊦㊦㊦㊦㊦㊦㊦㊦㊦㊦㊦㊦㊦㊦㊦㊦㊦㊦㊦㊦㊦㊦㊦㊦㊦㊦㊦㊦㊦㊦㊦㊦㊦㊦㊦㊦㊦㊦㊦㊦㊦㊦㊦㊦㊦㊦㊦㊦㊦㊦㊦㊦㊦㊦㊦㊦㊦㊦㊦㊦㊦㊦㊦㊦㊦㊦㊦㊦㊦㊦㊦㊦㊦㊦㊦㊦㊦㊦㊦㊦㊦㊦㊦㊦㊦㊦㊦㊦㊦㊦㊦㊦㊦㊦㊦㊦㊦㊦㊦㊦㊦㊦㊦㊦㊦㊦㊦㊦㊦㊦㊦㊦㊦㊦㊦㊦㊦㊦㊦㊦㊦㊦㊦㊦㊦㊦㊦㊦㊦㊦㊦㊦㊦㊦㊦㊦㊦㊦㊦㊦㊦㊦㊦㊦㊦㊦㊦㊦㊦㊦㊦㊦㊦㊦㊦㊦㊦㊦㊦㊦㊦㊦㊦㊦㊦㊦㊦㊦㊦㊦㊦㊦㊦㊦㊦㊦㊦㊦㊦㊦㊦㊦㊦㊦㊦㊦㊦㊦㊦㊦㊦㊦㊦㊦㊦㊦㊦㊦㊦㊦㊦㊦㊦㊦㊦㊦㊦㊦㊦㊦㊦㊦㊦㊦㊦㊦㊦㊦㊦㊦㊦㊦㊦㊦㊦㊦㊦㊦㊦㊦㊦㊦㊦㊦㊦㊦㊦㊦㊦㊦㊦㊦㊦㊦㊦㊦㊦㊦㊦㊦㊦㊦㊦㊦㊦㊦㊦㊦㊦㊦㊦㊦㊦㊦㊦㊦㊦㊦㊦㊦㊦㊦㊦㊦㊦㊦㊦㊦㊦㊦㊦㊦㊦㊦㊦㊦㊦㊦㊦㊦㊦㊦㊦㊦㊦㊦㊦㊦㊦㊦㊦㊦㊦㊦㊦㊦㊦㊦㊦㊦㊦㊦㊦㊦㊦㊦㊦㊦㊦㊦㊦㊦㊦㊦㊦㊦㊦㊦㊦㊦㊦㊦㊦㊦㊦㊦㊦㊦㊦㊦㊦㊦㊦㊦㊦㊦㊦㊦㊦㊦㊦㊦㊦㊦㊦㊦㊦㊦㊦㊦㊦㊦㊦㊦㊦㊦㊦㊦㊦㊦㊦㊦㊦㊦㊦㊦㊦㊦㊦㊦㊦㊦㊦㊦㊦㊦㊦㊦㊦㊦㊦㊦㊦㊦㊦㊦㊦㊦㊦㊦㊦㊦㊦㊦㊦㊦㊦㊦㊦㊦㊦㊦㊦㊦㊦㊦㊦㊦㊦㊦㊦㊦㊦㊦㊦㊦㊦㊦㊦㊦㊦㊦㊦㊦㊦㊦㊦㊦㊦㊦㊦㊦㊦㊦㊦㊦㊦㊦㊦㊦㊦㊦㊦㊦㊦㊦㊦㊦㊦㊦㊦㊦㊦㊦㊦㊦㊦㊦㊦㊦㊦㊦㊦㊦㊦㊦㊦㊦㊦㊦㊦㊦㊦㊦㊦㊦㊦㊦㊦㊦㊦㊦㊦㊦㊦㊦㊦㊦㊦㊦㊦㊦㊦㊦㊦㊦㊦㊦㊦㊦㊦㊦㊦㊦㊦㊦㊦㊦㊦㊦㊦㊦㊦㊦㊦㊦㊦㊦㊦㊦㊦㊦㊦㊦㊦㊦㊦㊦㊦㊦㊦㊦㊦㊦㊦㊦㊦㊦㊦㊦㊦㊦㊦㊦㊦㊦㊦㊦㊦㊦㊦㊦㊦㊦㊦㊦㊦㊦㊦㊦㊦㊦㊦㊦㊦㊦㊦㊦㊦㊦㊦㊦㊦㊦㊦㊦㊦㊦㊦㊦㊦㊦㊦㊦㊦㊦㊦㊦㊦㊦㊦㊦㊦㊦㊦㊦㊦㊦㊦㊦㊦㊦㊦㊦㊦㊦㊦㊦㊦㊦㊦㊦㊦㊦㊦㊦㊦㊦㊦㊦㊦㊦㊦㊦㊦㊦㊦㊦㊦㊦㊦㊦㊦㊦㊦㊦㊦㊦㊦㊦㊦㊦㊦㊦㊦㊦㊦㊦㊦㊦㊦㊦㊦㊦㊦㊦㊦㊦㊦㊦㊦㊦㊦㊦㊦㊦㊦㊦㊦㊦㊦㊦㊦㊦㊦㊦㊦㊦㊦㊦㊦㊦㊦㊦㊦㊦㊦㊦",
      "translationStatus": "draft",
      "translator": "Google Translate ja→ko (자동 초안); Codex 제어 토큰 단위 재번역",
      "reviewer": "",
      "referenceConsulted": false,
      "notes": "일본어 원문 기준 자동 번역 초안; 기존 번역 미참조; 제어 토큰 사이 일본어 조각을 분리해 원문 기준 재번역"
    }
  ]
}
