{
  "format": "siok-retranslation-overlay",
  "formatVersion": 1,
  "scope": "mtzkn_rt",
  "assetKey": "MTZKN_RT_ID00211",
  "baseline": {
    "sha256": "e1c6145fba10c34b38548169bf7470b9684f7f5eba48c8b6bfe47254c004530b",
    "rowCount": 62937
  },
  "translationPolicy": {
    "method": "fresh-from-japanese",
    "existingTranslations": "reference-only"
  },
  "entries": [
    {
      "entryId": "MTZKN_RT_ID00211/Sheet1/000002",
      "sourceBindingSha256": "ef4aad60f6acf11eecaaf1d413545773aa8403753f5d7ef49c159002ad36588a",
      "sourceTextSha256": "04e0d2c766e3b46051c4f48019d26a285dd0b59cbf31cca297d47e2bd40b733a",
      "freshTranslation": "에반게리온 신극장판 : 서",
      "translationStatus": "draft",
      "translator": "Google Translate ja→ko (자동 초안)",
      "reviewer": "",
      "referenceConsulted": false,
      "notes": "일본어 원문 기준 자동 번역 초안; 기존 번역 미참조"
    },
    {
      "entryId": "MTZKN_RT_ID00211/Sheet1/000003",
      "sourceBindingSha256": "4d269595d7f9a64cecae3411c39189ec1ce44acdbe9f6467a5cc528f1ba9680d",
      "sourceTextSha256": "9f1aca489bc035e5ff83f7459000a29dd50f0aed61a75ade6ccaa44836f4b827",
      "freshTranslation": "에반게리온 초호기",
      "translationStatus": "draft",
      "translator": "Google Translate ja→ko (자동 초안)",
      "reviewer": "",
      "referenceConsulted": false,
      "notes": "일본어 원문 기준 자동 번역 초안; 기존 번역 미참조"
    },
    {
      "entryId": "MTZKN_RT_ID00211/Sheet1/000004",
      "sourceBindingSha256": "253ebb44b01ccbfe19bcd058ebee0804c1a31f126c5996c539708594177840dd",
      "sourceTextSha256": "a8d1650a451a96d19ca8d59585b3e080bc9ab9f0dd3154eabd7d9e9654ff5d81",
      "freshTranslation": "범용 인간",
      "translationStatus": "draft",
      "translator": "Google Translate ja→ko (자동 초안)",
      "reviewer": "",
      "referenceConsulted": false,
      "notes": "일본어 원문 기준 자동 번역 초안; 기존 번역 미참조"
    },
    {
      "entryId": "MTZKN_RT_ID00211/Sheet1/000005",
      "sourceBindingSha256": "4ffb784f64f6fada9696a8ba52c60eb930a1b38a3149aecea2f6971419a70c49",
      "sourceTextSha256": "152bef1319107e076d50aff5ef1513732a9658ec53d5aa44a1cfa302425f2318",
      "freshTranslation": "결전 무기 인조 인간 에반게리온 시험 초호기",
      "translationStatus": "draft",
      "translator": "Google Translate ja→ko (자동 초안)",
      "reviewer": "",
      "referenceConsulted": false,
      "notes": "일본어 원문 기준 자동 번역 초안; 기존 번역 미참조"
    },
    {
      "entryId": "MTZKN_RT_ID00211/Sheet1/000006",
      "sourceBindingSha256": "6bb6dee951aaa144604e86f8b3f52a46a4534b4b6c73d453af1cc936bfc5f23d",
      "sourceTextSha256": "c75e6b3d4a8437f222c11861a9da7bd3c00d2b75c940e80f2569e4a3d6339f5a",
      "freshTranslation": "이카리 신지",
      "translationStatus": "draft",
      "translator": "Google Translate ja→ko (자동 초안)",
      "reviewer": "",
      "referenceConsulted": false,
      "notes": "일본어 원문 기준 자동 번역 초안; 기존 번역 미참조"
    },
    {
      "entryId": "MTZKN_RT_ID00211/Sheet1/000007",
      "sourceBindingSha256": "8ede8685621c3b073b7c20f405c0269886e78a7f201a5a13073e7185ff7cdf08",
      "sourceTextSha256": "a8d1650a451a96d19ca8d59585b3e080bc9ab9f0dd3154eabd7d9e9654ff5d81",
      "freshTranslation": "범용 인간",
      "translationStatus": "draft",
      "translator": "Google Translate ja→ko (자동 초안)",
      "reviewer": "",
      "referenceConsulted": false,
      "notes": "일본어 원문 기준 자동 번역 초안; 기존 번역 미참조"
    },
    {
      "entryId": "MTZKN_RT_ID00211/Sheet1/000008",
      "sourceBindingSha256": "dc2f6960a659b02a9df08a1f88f5803c1f8140aa305a025003b2489b38b49819",
      "sourceTextSha256": "bab8a93b91364a60c067df28e0624b39d1857dba00bdf777874bff444b19f513",
      "freshTranslation": "결전 무기·인조 인간 에반게리온의 시험 초호기. ㊥EVA 시리즈는 사도에 대항 가능한 인류 유일한 무기이며 특무기관 NERV가 ㊥ 거비를 들여 개발·건조를 진행하고 있다. ㊥의 가장 큰 특징은 A. T. 필드를 전개시키는 능력에 있다. ㊥ 주동력은 뒷면의 앰빌리컬 케이블에서 공급되는 전력. 케이블이 단선되는 ㊥와 내장 전원으로 전환되지만 5분 만에 활동 한계에 이른다. ㊥초호기의 주요 무장으로서 근접 전투용 프로그레시브 나이프, 대구경 209mm 소㊥총, 휴대",
      "translationStatus": "draft",
      "translator": "Google Translate ja→ko (자동 초안)",
      "reviewer": "",
      "referenceConsulted": false,
      "notes": "일본어 원문 기준 자동 번역 초안; 기존 번역 미참조"
    },
    {
      "entryId": "MTZKN_RT_ID00211/Sheet1/000009",
      "sourceBindingSha256": "6a86b4a9eb5f6ffda98ebbad7ef4e74e3cd888da5a9faddd97c1ac0e4016bc59",
      "sourceTextSha256": "b3ab665d147a700351cf970d26db150ba8efe07507ca3a37a656aaeab78e700b",
      "freshTranslation": "회전식 다포신 440mm 기관포 등을 사용한다.",
      "translationStatus": "draft",
      "translator": "Google Translate ja→ko (자동 초안)",
      "reviewer": "",
      "referenceConsulted": false,
      "notes": "일본어 원문 기준 자동 번역 초안; 기존 번역 미참조"
    },
    {
      "entryId": "MTZKN_RT_ID00211/Sheet1/000010",
      "sourceBindingSha256": "63825a9c2151f9a38e15eec85940536f175c2e958786de6152178994e8bcd9a5",
      "sourceTextSha256": "a8d1650a451a96d19ca8d59585b3e080bc9ab9f0dd3154eabd7d9e9654ff5d81",
      "freshTranslation": "범용 인간",
      "translationStatus": "draft",
      "translator": "Google Translate ja→ko (자동 초안)",
      "reviewer": "",
      "referenceConsulted": false,
      "notes": "일본어 원문 기준 자동 번역 초안; 기존 번역 미참조"
    },
    {
      "entryId": "MTZKN_RT_ID00211/Sheet1/000011",
      "sourceBindingSha256": "a688782384805fdde3951b108466d60914fb5a514d64d8d649ee713e4211206c",
      "sourceTextSha256": "4889febb3f0051f8686ffb8261cac0f89e02fe1b08ce9d1783fc41c316b015c2",
      "freshTranslation": "결전 무기·인조 인간 에반게리온의 시험 초호기. ㊥EVA 시리즈는 사도에 대항할 수 있는 인류 유일한 무기이며, 세계 각지의 NERV㊥이 거비를 들여 개발·건조를 진행하고 있다. ㊥의 가장 큰 특징은 A. T. 필드를 전개시키는 능력에 있다. \"AT\"와 ㊥은 \"ABSOLUTETERROR\"의 약자이며 사도가 전개하는 절대 불가침 영역 ㊥을 의미한다. EVA도 같은 능력을 갖춘 것으로, 상대의 필드를 침식해 코어 등 ㊥에의 공격을 처음으로 가능하게 하는 것이다. ㊥ 주동력은 뒷면의 앰빌리컬 케이블에서 공급되는 전력. 케이블이 단선되는 ㊥과 내장 전원으로 전환되지만 5분간 활동 한계에 이른다. ㊥초호기의 주요 무장으로서 근접 전투용 프로그레시브 나이프, 대구경 209mm 소㊥총, 휴대",
      "translationStatus": "draft",
      "translator": "Google Translate ja→ko (자동 초안)",
      "reviewer": "",
      "referenceConsulted": false,
      "notes": "일본어 원문 기준 자동 번역 초안; 기존 번역 미참조"
    },
    {
      "entryId": "MTZKN_RT_ID00211/Sheet1/000012",
      "sourceBindingSha256": "769c27c37c8d68c4e8c90a2b5cae2bea781b707afea2874fbb71060995a15f08",
      "sourceTextSha256": "cdb44f4891dc6766601c4e6a64c16e443dd3f487d54d5f3c869ae9c799cd289e",
      "freshTranslation": "회전식 다포신 440mm 기관포 등을 사용한다. ㊥ 제4 사도와의 싸움에서는 완전히 제어 불능이 되면서도 재기동해 폭주. 압도적 ㊥ 힘으로 사도를 섬멸한다. ㊥ 이와 같이 EVA 시리즈에는 미지의 부분이 많이 존재하고, 공개되고 있는 정보는 소 ㊥ 없다.",
      "translationStatus": "draft",
      "translator": "Google Translate ja→ko (자동 초안)",
      "reviewer": "",
      "referenceConsulted": false,
      "notes": "일본어 원문 기준 자동 번역 초안; 기존 번역 미참조"
    }
  ]
}
